SYMBOL,DESCRIPTION,IBKR-SYMBOL,CURRENCY,PRODUCT,REGION,EXCHANGE
"ACAA","ARROW LONG/SHORT ALTR CL-CAD","ACAA","CAD","ETF","CA","TSE*"
"ADIV","ARRW EC EQTY ADGE ALT FUND","ADIV","CAD","ETF","CA","TSE*"
"AEMX","AGF EM MKTS EX CHINA FUND","AEMX","CAD","ETF","CA","AEQLIT*"
"AENU","AGF ENHANCED US EQTY INC FD","AENU","CAD","ETF","CA","AEQLIT*"
"AGLR","AGF GLOBAL REAL ASSETS FUND","AGLR","CAD","ETF","CA","AEQLIT*"
"AGSG","AGF GLOBAL SUSTAINABLE GROW","AGSG","CAD","ETF","CA","AEQLIT*"
"AIGO","GLOBAL X AIT INDEX ETF","AIGO","CAD","ETF","CA","TSE*"
"AMAX","HAMILTON GOLD PRODUCER YLD","AMAX","CAD","ETF","CA","TSE*"
"APLY","APPLE YLD SHARES PURPOSE","APLY","CAD","ETF","CA","AEQLIT*"
"ARB","ACCELERATE ARBITRAGE FUND","ARB","CAD","ETF","CA","TSE*"
"ARKG","BMO ARK GENOMIC REV FUND ETF","ARKG","CAD","ETF","CA","TSE*"
"ARKK","BMO ARK INNOVATION FUND ETF","ARKK","CAD","ETF","CA","TSE*"
"ARKW","BMO ARK NXT GEN INTRNT ETF","ARKW","CAD","ETF","CA","TSE*"
"ARTI","EVOLVE AI FUND","ARTI","CAD","ETF","CA","TSE*"
"ATSX","ACCELERATE CANADIAN L SH EF","ATSX","CAD","ETF","CA","TSE*"
"AUGB.F","FT VT US EQ BF ETF-AUG","AUGB.F","CAD","ETF","CA","TSE*"
"BANK","EVOL C BKN LC EN YLD IDX FD","BANK","CAD","ETF","CA","TSE*"
"BASE","EVOLVE GLOBAL MAT &amp; MIN EN Y","BASE","CAD","ETF","CA","TSE*"
"BASE.B","EVOLVE GLOBAL MAT &amp; MIN EN Y","BASE.B","CAD","ETF","CA","TSE*"
"BDIV","BROMPTON GLOBAL DIVIDEND-ETF","BDIV","CAD","ETF","CA","TSE*"
"BEPR","BROMPTON ENHANCED IG PREF","BEPR","CAD","ETF","CA","TSE*"
"BESG","INVESCO ESG CANADIAN CORE PL","BESG","CAD","ETF","CA","TSE*"
"BFIN","BROMPTON NORTH AMERICAN FINA","BFIN","CAD","ETF","CA","TSE*"
"BGC","BRISTOL GATE CONCENTRAT ETF","BGC","CAD","ETF","CA","TSE*"
"BGDV","BMO GLBL DVD OPPORTUNITIES","BGDV","CAD","ETF","CA","AEQLIT*"
"BGEQ","BMO GLOBAL EQUITY FUND","BGEQ","CAD","ETF","CA","AEQLIT*"
"BGHC","BMO GLOBAL HEALTH CARE FUND","BGHC","CAD","ETF","CA","AEQLIT*"
"BGIF","BMO GLBL INFRA FUND","BGIF","CAD","ETF","CA","AEQLIT*"
"BGIN","BMO GLOBAL INNOVATORS FUND","BGIN","CAD","ETF","CA","AEQLIT*"
"BGRT","BMO GLOBAL REIT FUND","BGRT","CAD","ETF","CA","AEQLIT*"
"BGU","BRISTOL GATE CONCEN US ETF","BGU","CAD","ETF","CA","TSE*"
"BGU.U","BRISTOL GATE CONCEN USD ETF","BGU.U","USD","ETF","CA","TSE*"
"BITI","BETAPRO INVERSE BITCOIN ETF","BITI","CAD","ETF","CA","TSE*"
"BKCC","GLO X EQU WGT CAND BNK COV C","BKCC","CAD","ETF","CA","TSE*"
"BKCC.OLD","HORIZONS EQUAL WEIGHT CANADI ","BKCC.OLD","null","ETF","CA","TSE*"
"BKCL","GLB X ENH EQ CDN ETF-A CAD I","BKCL","CAD","ETF","CA","TSE*"
"BKCL.OLD","HORIZ ENH EQ WT CAN BANK COV","BKCL.OLD","null","ETF","CA","TSE*"
"BLCK","FT INDXX INNOVATIVE TRANS/CA","BLCK","CAD","ETF","CA","TSE*"
"BLOV","BROMPTON NORTH AMER LOW VOL","BLOV","CAD","ETF","CA","TSE*"
"BMAX","BROMPTON ENH MULTI-ASSET ETF","BMAX","CAD","ETF","CA","TSE*"
"BNC","PURPOSE CDN FIF ETF SHARES","BNC","CAD","ETF","CA","TSE*"
"BND","PURPOSE GLOBAL BOND FUND","BND","CAD","ETF","CA","TSE*"
"BNKL","GLOBAL X ENHANCED EQL-A CD I","BNKL","CAD","ETF","CA","TSE*"
"BNKL.OLD","HORIZONS ENH EQ WEIGHT BANKS","BNKL.OLD","null","ETF","CA","TSE*"
"BOND","EVOLVE ENHANCED YLD BND FUND","BOND","CAD","ETF","CA","TSE*"
"BOND.B","EVOLVE ENHANCED YLD BND FUND","BOND.B","CAD","ETF","CA","TSE*"
"BPRF","BROMPTON FLAHERTY &amp; CRUMI ET","BPRF","CAD","ETF","CA","TSE*"
"BREA","BROMPTON SUST RL ASST DVD","BREA","CAD","ETF","CA","TSE*"
"BRKY","BERKSHIRE HATHAWAY YLD SH PU","BRKY","CAD","ETF","CA","AEQLIT*"
"BSKT","MANULIFE SMART CORE BOND ETF","BSKT","CAD","ETF","CA","TSE*"
"BTCC","PURPOSE BITCOIN ETF","BTCC","CAD","ETF","CA","TSE*"
"BTCC.B","PURPOSE BITCOIN ETF","BTCC.B","CAD","ETF","CA","TSE*"
"BTCC.J","PURPOSE BITCOIN ETF","BTCC.J","CAD","ETF","CA","TSE*"
"BTCC.U","PURPOSE BITCOIN ETF","BTCC.U","USD","ETF","CA","TSE*"
"BTCQ","3IQ BITCOIN ETF","BTCQ","CAD","ETF","CA","TSE*"
"BTCQ.U","3IQ BITCOIN ETF","BTCQ.U","USD","ETF","CA","TSE*"
"BTCX.B","CI GALAXY BITCOIN ETF","BTCX.B","CAD","ETF","CA","TSE*"
"BTCX.U","CI GALAXY BITCOIN ETF USD","BTCX.U","USD","ETF","CA","TSE*"
"BTCY","PURPOSE BITCOIN YIELD ETF","BTCY","CAD","ETF","CA","TSE*"
"BTCY.B","PURPOSE BITCOIN YIELD ETF","BTCY.B","CAD","ETF","CA","TSE*"
"BTCY.U","PURPOSE BITCOIN YIELD ETF-US","BTCY.U","USD","ETF","CA","TSE*"
"BUFR","FIRST TRUST VEST FUND OF BUF","BUFR","CAD","ETF","CA","AEQLIT*"
"BXF","CI 1-5 YEAR LADDERED GOVERN","BXF","CAD","ETF","CA","TSE*"
"CACB","CIBC ACTIVE INVESTMENT GRADE","CACB","CAD","ETF","CA","TSE*"
"CAFR","CIBC ACTIVE INVST GR BND ETF","CAFR","CAD","ETF","CA","TSE*"
"CAGG","CI CANADIAN AGG BD INDEX ETF","CAGG","CAD","ETF","CA","TSE*"
"CAGS","CI CN SH-TERM AG BD INDX ETF","CAGS","CAD","ETF","CA","TSE*"
"CALL","EVOLVE US BANKS ENHANCED YIE","CALL","CAD","ETF","CA","TSE*"
"CALL.B","EVOLVE US BANKS UNHEDGED","CALL.B","CAD","ETF","CA","TSE*"
"CALL.U","EVOLVE US BANKS ENHANCED YIE","CALL.U","USD","ETF","CA","TSE*"
"CANL","GLOB X ENH S&amp;P/TSX 60 IN ETF","CANL","CAD","ETF","CA","TSE*"
"CANL.OLD","HORIZONS ENH S&amp;P/TSX 60 INDX","CANL.OLD","null","ETF","CA","TSE*"
"CARB","GLOBAL X CARBON CREDITS ETF","CARB","CAD","ETF","CA","TSE*"
"CARB.OLD","HORIZONS CARBON CREDITS ETF","CARB.OLD","null","ETF","CA","TSE*"
"CARS","EVOLVE AUTOMOBILE INNOVATION","CARS","CAD","ETF","CA","TSE*"
"CARS.B","EVOLVE AUTO INNOVATION ETF","CARS.B","CAD","ETF","CA","TSE*"
"CASH","GLB X HIGH INTERST SVNGS ETF","CASH","CAD","ETF","CA","TSE*"
"CASH.OLD","HORIZONS HIGH INT SAVINGS","CASH.OLD","null","ETF","CA","TSE*"
"CBAL","CI BAL ASSET ALLOC ETF","CBAL","CAD","ETF","CA","TSE*"
"CBCX","CI GALAXY BLOCKCHAIN INDEX E","CBCX","CAD","ETF","CA","TSE*"
"CBGR","CI BAL GRWTH ASSET ALLOC ETF","CBGR","CAD","ETF","CA","TSE*"
"CBH","ISHARES 1-10 YEAR LADDERED C","CBH","CAD","ETF","CA","TSE*"
"CBIL","GLOBAL X 0-3 MONTH T-BILL-A","CBIL","CAD","ETF","CA","TSE*"
"CBIL.OLD","HORIZONS 0-3 MONTH TBILL ETF","CBIL.OLD","null","ETF","CA","TSE*"
"CBIN","CI BAL INC ASSET ALLOC ETF","CBIN","CAD","ETF","CA","TSE*"
"CBND","MANULIFE SMART CORPORATE BND","CBND","CAD","ETF","CA","TSE*"
"CBNK","MULVIHILL CANADIAN BANK ENHA","CBNK","CAD","ETF","CA","TSE*"
"CBO","ISHARES 1-5 YEAR LADDERED CO","CBO","CAD","ETF","CA","TSE*"
"CBON","NINEPOINT CARBON CREDIT ETF","CBON","CAD","ETF","CA","AEQLIT*"
"CBON.U","NINEPOINT CARBON CREDIT-U","CBON.U","USD","ETF","CA","AEQLIT*"
"CBUG","CI DIGITAL SECURITY INDEX ET","CBUG","CAD","ETF","CA","TSE*"
"CCBI","CIBC CANADIAN BOND INDEX ETF","CCBI","CAD","ETF","CA","TSE*"
"CCDN","CI CANADIAN EQUITY INDEX ETF","CCDN","CAD","ETF","CA","AEQLIT*"
"CCEI","CIBC CANADIAN EQUITY INDEX","CCEI","CAD","ETF","CA","TSE*"
"CCLN","CIBC CLEAN ENERGY ETF","CCLN","CAD","ETF","CA","AEQLIT*"
"CCNS","CIBC CONSERVATIVE FI POOL","CCNS","CAD","ETF","CA","TSE*"
"CCNV","CI CONSV ASSET ALLOC ETF","CCNV","CAD","ETF","CA","TSE*"
"CCOM","CI AUSPICE BROAD COMMODITY F","CCOM","CAD","ETF","CA","TSE*"
"CCRE","CIBC CORE FIXED INCOME ETF","CCRE","CAD","ETF","CA","TSE*"
"CDEF","MANULIFE SMART DEFENSIVE EQY","CDEF","CAD","ETF","CA","TSE*"
"CDIV","MANULIFE SMART DIVIDEND ETF","CDIV","CAD","ETF","CA","TSE*"
"CDLB","CI DL TOTAL RETURN BOND USD","CDLB","CAD","ETF","CA","TSE*"
"CDLB.B","CI DL TOTAL RETURN BOND US-B","CDLB.B","CAD","ETF","CA","TSE*"
"CDNA","CI BIO-REVOLUTION INDEX ETF","CDNA","CAD","ETF","CA","TSE*"
"CDZ","ISHARES S&amp;P/TSX CANADIAN DIV","CDZ","CAD","ETF","CA","TSE*"
"CEMI","CIBC EMERGING MARKETS EQUITY","CEMI","CAD","ETF","CA","TSE*"
"CEQT","CI EQ ASSET ALLOC ETF","CEQT","CAD","ETF","CA","TSE*"
"CESG","CI MSCI WORLD ESG IMPACT IND","CESG","CAD","ETF","CA","AEQLIT*"
"CESG.B","CI MSCI WORLD ESG IMPT-B","CESG.B","CAD","ETF","CA","AEQLIT*"
"CEW","ISHARES EQUAL WEIGHT BANC &amp;","CEW","CAD","ETF","CA","TSE*"
"CFLX","CIBC FLEXIBLE YIELD ETF-CAD","CFLX","CAD","ETF","CA","TSE*"
"CFRT","CI FLOATING RATE INCOME FUND","CFRT","CAD","ETF","CA","TSE*"
"CGAA","CI GLOBAL ASSET ALLOCATION P","CGAA","CAD","ETF","CA","TSE*"
"CGBI","CIBC GLOBAL BOND EX-CANADA I","CGBI","CAD","ETF","CA","TSE*"
"CGDV","CI GLOB MIN DOWNSIDE VOL-HED","CGDV","CAD","ETF","CA","TSE*"
"CGDV.B","CI GLOB MIN DOWNSIDE VOL-UNH","CGDV.B","CAD","ETF","CA","TSE*"
"CGHY","CI GLOBAL HIGH YIELD CR P ET","CGHY","CAD","ETF","CA","TSE*"
"CGIN","CI GLB INVSTMNT GRD ETF-CAD","CGIN","CAD","ETF","CA","TSE*"
"CGL","ISHARES GOLD BULLION ETF","CGL","CAD","ETF","CA","TSE*"
"CGL.C","ISHARES GOLD BULLION FUND","CGL.C","CAD","ETF","CA","TSE*"
"CGLO","CIBC GLOBAL GROWTH ETF","CGLO","CAD","ETF","CA","TSE*"
"CGR","ISHARES GLOBAL REAL ESTATE I","CGR","CAD","ETF","CA","TSE*"
"CGRA","CI GLOBAL REAL ASSET PRIVATE","CGRA","CAD","ETF","CA","TSE*"
"CGRB","CI GLOBAL GREEN BOND FUND","CGRB","CAD","ETF","CA","TSE*"
"CGRE","CI GLOBAL REIT PRIVATE POOL","CGRE","CAD","ETF","CA","TSE*"
"CGRN","CI GL SUSTAINABLE INFRASTRUC","CGRN","CAD","ETF","CA","TSE*"
"CGRO","CI GRWTH ASSET ALLOC ETF","CGRO","CAD","ETF","CA","TSE*"
"CGXF","CI GOLD GIANTS COVERED CALL","CGXF","CAD","ETF","CA","TSE*"
"CGXF.U","CI GOLD GIANTS COVERED CALL","CGXF.U","USD","ETF","CA","TSE*"
"CHCL.B","CI GLOBAL HEALTHCARE LEADERS","CHCL.B","CAD","ETF","CA","AEQLIT*"
"CHNA.B","CI ICBCCS S&amp;P CHINA 500 INDE","CHNA.B","CAD","ETF","CA","TSE*"
"CHPS","GLOBAL X SEMICOND INDEX ETF","CHPS","CAD","ETF","CA","TSE*"
"CHPS.OLD","HORIZONS GLB SEMICON INDEX","CHPS.OLD","null","ETF","CA","TSE*"
"CIAI","CI GLBL ARTIFICIAL INTEL ETF","CIAI","CAD","ETF","CA","TSE*"
"CIBR","FIRSTTRUST NASDAQ CYBERSECUR","CIBR","CAD","ETF","CA","TSE*"
"CIC","CI CANADIAN BANKS COVERED CA","CIC","CAD","ETF","CA","TSE*"
"CIE","ISHARES INTERNATIONAL FUNDAM","CIE","CAD","ETF","CA","AEQLIT*"
"CIEH","CIBC INT EQUITY INDX ETF-C H","CIEH","CAD","ETF","CA","TSE*"
"CIEI","CIBC INT EQUITY INDEX ETF","CIEI","CAD","ETF","CA","TSE*"
"CIEM","CI EMERGING MARKETS ALPHA","CIEM","CAD","ETF","CA","TSE*"
"CIF","ISHARES GLOBAL INFRASTRUCTUR","CIF","CAD","ETF","CA","TSE*"
"CINF","CI GLOBAL INFR PRIVATE POOL","CINF","CAD","ETF","CA","TSE*"
"CINT","CIBC INTERNATIONAL EQUITY ET","CINT","CAD","ETF","CA","TSE*"
"CINV","CI GLOBAL ALPHA INNOVATION","CINV","CAD","ETF","CA","TSE*"
"CJP","ISHARES JAPAN FUNDAMENTAL IN","CJP","CAD","ETF","CA","AEQLIT*"
"CLF","ISHARES 1-5 YEAR LADDERED GO","CLF","CAD","ETF","CA","TSE*"
"CLG","ISHARES 1-10 YEAR LADDERED G","CLG","CAD","ETF","CA","TSE*"
"CLML","CI GLOBAL CLIMATE LEADERS FD","CLML","CAD","ETF","CA","TSE*"
"CLU","ISHARES US FUNDAMENTAL INDEX","CLU","CAD","ETF","CA","AEQLIT*"
"CLU.C","ISHARES US FUNDAMEN-NON HEDG","CLU.C","CAD","ETF","CA","AEQLIT*"
"CMAG","CI MUNRO ALTERNATIVE GLOBAL","CMAG","CAD","ETF","CA","TSE*"
"CMAR","CI MARRET ALTERNATIVE ABSOLU","CMAR","CAD","ETF","CA","TSE*"
"CMCX.B","CI GALAXY MULTI - CRYPTO E-B","CMCX.B","CAD","ETF","CA","TSE*"
"CMCX.U","CI GALAXY MULTI - CRYPTO ETF","CMCX.U","USD","ETF","CA","TSE*"
"CMDO","CI ALTERNATIVE DIVERSIFIED","CMDO","CAD","ETF","CA","TSE*"
"CMEY","CI MARRET ALT ENH YIELD FUND","CMEY","CAD","ETF","CA","TSE*"
"CMGG","CI MUNRO GLOBAL GROWTH EQTY","CMGG","CAD","ETF","CA","TSE*"
"CMNY","CI MONEY MARKET ETF","CMNY","CAD","ETF","CA","TSE*"
"CMOM","CI US ENH MOMTM IND (HEDGED)","CMOM","CAD","ETF","CA","TSE*"
"CMOM.B","CI US ENH MOMTM IND (UNHEDG)","CMOM.B","CAD","ETF","CA","TSE*"
"CMR","ISHARES PREMIUM MONEY MARKET","CMR","CAD","ETF","CA","TSE*"
"CMVX","CI GALAXY METAVERSE INDEX ET","CMVX","CAD","ETF","CA","TSE*"
"CNAO","CI ALTERNATIVE NORTH AMERICA","CNAO","CAD","ETF","CA","TSE*"
"CNCC","GLB X S&amp;P/TSX 60 COVERED ETF","CNCC","CAD","ETF","CA","TSE*"
"CNCC.OLD","HORIZONS CANADIAN LARGE CAP ","CNCC.OLD","null","ETF","CA","TSE*"
"CNCL","GL X EN S&amp;P/TSX 60CO CAL ETF","CNCL","CAD","ETF","CA","TSE*"
"CNCL.OLD","HORIZONS ENH CAN LARGE CAP","CNCL.OLD","null","ETF","CA","TSE*"
"CNDX","GLOBAL X S&amp;P/TSX 60 IDX ETF","CNDX","CAD","ETF","CA","TSE*"
"COMM","BMO GLOBAL COMMUNICATIONS IN","COMM","CAD","ETF","CA","TSE*"
"COPJ","SPROTT JR COPPER MINERS ETF","COPJ","USD","ETF","CA","NASDAQ*"
"COPP","GLOBAL X COPPER PRODUCER IND","COPP","CAD","ETF","CA","TSE*"
"COPP.OLD","HORIZONS COPPER PROD IND ETF","COPP.OLD","null","ETF","CA","TSE*"
"COW","ISHARES GLOBAL AGRICULTURE I","COW","CAD","ETF","CA","TSE*"
"CPD","ISHARES S&amp;P/TSX CANADIAN PRE","CPD","CAD","ETF","CA","TSE*"
"CPLS","CIBC CORE PLUS FI POOL ETF","CPLS","CAD","ETF","CA","TSE*"
"CQLC","CIBC QX CANADIAN LOW VOL DVD","CQLC","CAD","ETF","CA","AEQLIT*"
"CQLI","CIBC QX INT LOW VOL DVD ETF","CQLI","CAD","ETF","CA","AEQLIT*"
"CQLU","CIBC QX US LOW VOL DVD ETF","CQLU","CAD","ETF","CA","AEQLIT*"
"CRED","CI ALTERNATIVE INVESTMENT GR","CRED","CAD","ETF","CA","TSE*"
"CRED.U","CI LAWRENCE PARK ALT INVT US","CRED.U","USD","ETF","CA","TSE*"
"CROP","PURPOSE CREDIT OPPORTUNITIES","CROP","CAD","ETF","CA","TSE*"
"CRQ","ISHARES CANADIAN FUNDAMENTAL","CRQ","CAD","ETF","CA","AEQLIT*"
"CSAV","CI HIGH INTEREST SAVINGS ETF","CSAV","CAD","ETF","CA","TSE*"
"CSBA","CIBC SUSTAINABLE BALANCED SO","CSBA","CAD","ETF","CA","AEQLIT*"
"CSBG","CIBC SUSTAINABLE BALANCED GR","CSBG","CAD","ETF","CA","AEQLIT*"
"CSBI","CIBC CANADIAN SH-TRM BND ETF","CSBI","CAD","ETF","CA","TSE*"
"CSCB","CIBC SUSTAINABLE CONSERVATIV","CSCB","CAD","ETF","CA","AEQLIT*"
"CSCE","CIBC SUSTAINABLE CANADIAN EQ","CSCE","CAD","ETF","CA","AEQLIT*"
"CSCP","CIBC SUSTAINABLE CANADIAN CO","CSCP","CAD","ETF","CA","AEQLIT*"
"CSGE","CIBC SUSTAINABLE GLOBAL EQUI","CSGE","CAD","ETF","CA","AEQLIT*"
"CTIP","CI US TREASURY INFLATION-LIN","CTIP","CAD","ETF","CA","AEQLIT*"
"CUD","ISHARES US DIVIDEND GROWERS","CUD","CAD","ETF","CA","TSE*"
"CUDV","CI US MIN DOWN VOL ETF HDG","CUDV","CAD","ETF","CA","TSE*"
"CUDV.B","CI US MIN DOWN VOL ETF UNHDG","CUDV.B","CAD","ETF","CA","TSE*"
"CUEH","CIBC US EQT IND CA HD ET-C H","CUEH","CAD","ETF","CA","TSE*"
"CUEI","CIBC US EQUITY INDEX ETF","CUEI","CAD","ETF","CA","TSE*"
"CUSA","CI US 500 INDEX ETF","CUSA","CAD","ETF","CA","AEQLIT*"
"CUSA.B","CI US 500 INDEX ETF","CUSA.B","CAD","ETF","CA","AEQLIT*"
"CUSM.B","CI US 1000 INDEX ETF","CUSM.B","CAD","ETF","CA","AEQLIT*"
"CUTL","CI UTIL GIANT COV CAL ETF-HC","CUTL","CAD","ETF","CA","TSE*"
"CUTL.B","CI UTIL GIANT COV CAL ETF-UH","CUTL.B","CAD","ETF","CA","TSE*"
"CVD","ISHARES CONVERTIBLE BOND IND","CVD","CAD","ETF","CA","TSE*"
"CVLU","CI US ENH VAL IND (HEDGED)","CVLU","CAD","ETF","CA","TSE*"
"CVLU.B","CI US ENH VAL IND (UNHEDGED)","CVLU.B","CAD","ETF","CA","TSE*"
"CWO","ISHARES EMERGING MARKETS FUN","CWO","CAD","ETF","CA","AEQLIT*"
"CWW","ISHARES GLOBAL WATER INDEX E","CWW","CAD","ETF","CA","TSE*"
"CXF","CI CANADIAN CONVERTIBLE BOND","CXF","CAD","ETF","CA","TSE*"
"CYBR","EVOLVE CYBER SECURITY INDEX","CYBR","CAD","ETF","CA","TSE*"
"CYBR.B","EVOLVE CYBER SECURITY INDEX","CYBR.B","CAD","ETF","CA","TSE*"
"CYH","ISHARES GLOBAL MONTHLY DIVID","CYH","CAD","ETF","CA","TSE*"
"DAMG","DESJ ALT LG/SHT GLB EQY ETF","DAMG","CAD","ETF","CA","TSE*"
"DANC","DESJARDINS ALT LONG/SHORT MT","DANC","CAD","ETF","CA","TSE*"
"DANC.U","DESJ ALT LG/SHT MKT NTRL USH","DANC.U","USD","ETF","CA","TSE*"
"DATA","EVOLVE CLOUD COMPUTING INDEX","DATA","CAD","ETF","CA","TSE*"
"DATA.B","EVOLVE CLOUD COMPUTING IN-B","DATA.B","CAD","ETF","CA","TSE*"
"DCBC","DESJARDINS CNDIN CP BN I ETF","DCBC","CAD","ETF","CA","TSE*"
"DCC","DESJARDINS 1-5 YR CAD CORP","DCC","CAD","ETF","CA","TSE*"
"DCG","DESJARDINS 1-5 YR LAT GOV BD","DCG","CAD","ETF","CA","TSE*"
"DCP","DESJARDINS CAD PREFERRED","DCP","CAD","ETF","CA","TSE*"
"DCS","DESJARDINS CAD SHORT TERM BD","DCS","CAD","ETF","CA","TSE*"
"DCU","DESJARDINS CAD UNIVERSE BOND","DCU","CAD","ETF","CA","TSE*"
"DGR","CI US QUALITY DIVIDEND GROWTH","DGR","CAD","ETF","CA","TSE*"
"DGR.B","CI US QUALITY DIVIDEND GROWTH","DGR.B","CAD","ETF","CA","TSE*"
"DGRC","CI CANADA QUALITY DIVIDEND GRO","DGRC","CAD","ETF","CA","TSE*"
"DISC","BMO GLBL CONSUMER DISCRETION","DISC","CAD","ETF","CA","TSE*"
"DIVS","EVOLVE ACTIVE CANADIAN PREFE","DIVS","CAD","ETF","CA","TSE*"
"DLR","GLOBAL X US DOLLAR CURRENCY","DLR","CAD","ETF","CA","TSE*"
"DLR.OLD","HORIZONS US DOLLAR CRNCY ETF","DLR.OLD","null","ETF","CA","TSE*"
"DLR.U","GLOBAL X US DOLLAR CURRENCY","DLR.U","USD","ETF","CA","TSE*"
"DLR.U.OLD","HORIZONS US DOLLAR CRNCY ETF","DLR.U.OLD","null","ETF","CA","TSE*"
"DMEC","DESJARDINS CANDN EQU IN ETF","DMEC","CAD","ETF","CA","TSE*"
"DMEI","DESJARDINS INTERN EQ IN ETF","DMEI","CAD","ETF","CA","TSE*"
"DMEU","DESJARDINS AMRICAN EQ IN ETF","DMEU","CAD","ETF","CA","TSE*"
"DRCU","DESJARDINS RI ACTIVE CANADIA","DRCU","CAD","ETF","CA","TSE*"
"DRFC","DESJARDINS RI CANADA MULTIFA","DRFC","CAD","ETF","CA","TSE*"
"DRFD","DESJARDINS RI DEVELOPED EX-U","DRFD","CAD","ETF","CA","TSE*"
"DRFE","DESJARDINS RI EMERGING MARKE","DRFE","CAD","ETF","CA","TSE*"
"DRFG","DESJARDINS GLB MF FOSS FUEL","DRFG","CAD","ETF","CA","TSE*"
"DRFU","DESJARDINS RI USA MULTIFACTO","DRFU","CAD","ETF","CA","TSE*"
"DRMC","DESJARDINS RI CANADA - NET-Z","DRMC","CAD","ETF","CA","TSE*"
"DRMD","DESJARDINS RI DEVELOPED EX-U","DRMD","CAD","ETF","CA","TSE*"
"DRME","DESJARDINS RI EMERGING MARKE","DRME","CAD","ETF","CA","TSE*"
"DRMU","DESJARDINS RI USA - NET-ZERO","DRMU","CAD","ETF","CA","TSE*"
"DSAE","DESJA SUS AMERICAN EQ ETF- A","DSAE","CAD","ETF","CA","TSE*"
"DXB","DYNAMIC ACTIVE TACTICAL BOND","DXB","CAD","ETF","CA","TSE*"
"DXBC","DYNAMIC ACTIVE CDN BOND ETF","DXBC","CAD","ETF","CA","TSE*"
"DXBU","DYNAMIC ACTIVE US IG BD ETF","DXBU","CAD","ETF","CA","TSE*"
"DXC","DYNAMIC ACTIVE CANADIAN DIVI","DXC","CAD","ETF","CA","TSE*"
"DXDB","DYNAMIC ACTV DISCOUNT BD ETF","DXDB","CAD","ETF","CA","TSE*"
"DXEM","DYNAMIC ACTIVE EMERGING MARK","DXEM","CAD","ETF","CA","TSE*"
"DXET","DYNAMIC ACTIVE ENERGY EVOLUT","DXET","CAD","ETF","CA","TSE*"
"DXF","DYNAMIC ACTIVE GLOBAL FINANC","DXF","CAD","ETF","CA","TSE*"
"DXG","DYNAMIC ACTIVE GLOBAL DIVIDE","DXG","CAD","ETF","CA","TSE*"
"DXGE","DYNAMIC ACT GLB EQU INC ETF","DXGE","CAD","ETF","CA","TSE*"
"DXIF","DYNAMIC ACTIVE INTERNATIONAL","DXIF","CAD","ETF","CA","TSE*"
"DXN","DYNAMIC ACTIVE GLOBAL INFRAS","DXN","CAD","ETF","CA","TSE*"
"DXO","DYNAMIC ACTIVE CROSSOVER BON","DXO","CAD","ETF","CA","TSE*"
"DXP","DYNAMIC ACTIVE PREFERRED SHA","DXP","CAD","ETF","CA","TSE*"
"DXQ","DYNAMIC ACTV EN YLD OPT ETF","DXQ","CAD","ETF","CA","TSE*"
"DXR","DYNAMIC ACTIVE RETIREMENT IN","DXR","CAD","ETF","CA","TSE*"
"DXU","DYNAMIC ACTIVE US DIVIDEND E","DXU","CAD","ETF","CA","TSE*"
"DXUS","DYNAMIC ACTIVE US EQUITY ETF","DXUS","CAD","ETF","CA","TSE*"
"DXV","DYNAMIC ACTIVE INVESTMENT GR","DXV","CAD","ETF","CA","TSE*"
"DXW","DYNAMIC ACTIVE INTERNATIONAL","DXW","CAD","ETF","CA","TSE*"
"DXZ","DYNAMIC ACTIVE US MID-CAP ET","DXZ","CAD","ETF","CA","TSE*"
"EACC","GLOBAL X MSCI EAFE CC ETF","EACC","CAD","ETF","CA","AEQLIT*"
"EACL","GBL X ENH MSCI EAFE CO C ETF","EACL","CAD","ETF","CA","AEQLIT*"
"EAFL","GLOBAL X EHD MSCI EF IDX ETF","EAFL","CAD","ETF","CA","AEQLIT*"
"EAFX","GLOBAL X MSCI EAFE INDEX ETF","EAFX","CAD","ETF","CA","AEQLIT*"
"EAFX.U","GLOBAL X MSCI EAFE INDEX ETF","EAFX.U","USD","ETF","CA","AEQLIT*"
"EARN","EVOLVE ACTIVE GLOBAL FIXED","EARN","CAD","ETF","CA","TSE*"
"EBIT","EVOLVE BITCOIN ETF","EBIT","CAD","ETF","CA","TSE*"
"EBIT.U","EVOLVE BITCOIN ETF USD","EBIT.U","USD","ETF","CA","TSE*"
"EBNK","EVOLV EURO BKS ENH YLD ETF","EBNK","CAD","ETF","CA","TSE*"
"EBNK.B","EVOLV EURO BKS ENH YLD ETF-B","EBNK.B","CAD","ETF","CA","TSE*"
"EDGE","EVOLVE INNOVATION INDEX FUND","EDGE","CAD","ETF","CA","TSE*"
"EDGE.U","EVOLVE INNOVATION INDEX-USD","EDGE.U","USD","ETF","CA","TSE*"
"EDGF","BROMPTON EUROPEAN DIVIDEND G","EDGF","CAD","ETF","CA","TSE*"
"EGIF","EXEMPLAR GROWTH AND INCOME E","EGIF","CAD","ETF","CA","TSE*"
"EHE","CI EUROPE HEDGED EQUITY INDEX","EHE","CAD","ETF","CA","TSE*"
"EHE.B","CI EUROPE HEDGED EQUITY INDEX","EHE.B","CAD","ETF","CA","TSE*"
"EMAX","HAMILTON ENERGY YIELD MAX","EMAX","CAD","ETF","CA","TSE*"
"EMCC","GLOBAL X MSCI EMCC ETF","EMCC","CAD","ETF","CA","AEQLIT*"
"EMCL","GBL X ENHANC MSCI EM CC ETF","EMCL","CAD","ETF","CA","AEQLIT*"
"EMML","GBL X ENH MSCI E MRK IND ETF","EMML","CAD","ETF","CA","AEQLIT*"
"EMMX","GLOBAL X MSCI EMR MRK IN ETF","EMMX","CAD","ETF","CA","AEQLIT*"
"EMMX.U","GLOBAL X MSCI EMR MRK IN ETF","EMMX.U","USD","ETF","CA","AEQLIT*"
"EMV.B","CI EMERGING MARKETS DIVIDEND I","EMV.B","CAD","ETF","CA","TSE*"
"ENCC","GLOBAL X CANADIAN OIL AND GA","ENCC","CAD","ETF","CA","TSE*"
"ENCC.OLD","HORIZONS CANADIAN OIL AND GA","ENCC.OLD","null","ETF","CA","TSE*"
"ENCL","GBL X EN CA OIL&amp;GAS EQ C ETF","ENCL","CAD","ETF","CA","TSE*"
"ENCL.OLD","HORIZONS ENH CAN OIL GAS ETF","ENCL.OLD","null","ETF","CA","TSE*"
"EQCC","GBL X ALL-EQ AST ALL CC ETF","EQCC","CAD","ETF","CA","TSE*"
"EQCL","GLB X EN ALL-EQ AS AL CO ETF","EQCL","CAD","ETF","CA","TSE*"
"EQCL.OLD","HORIZONS ENH A-E AA CC ETF","EQCL.OLD","null","ETF","CA","TSE*"
"EQE","INVESCO S&amp;P EU 350 EQL WGHT","EQE","CAD","ETF","CA","AEQLIT*"
"EQE.F","INVESCO S&amp;P EU 350-HEDGED","EQE.F","CAD","ETF","CA","AEQLIT*"
"EQL","INVESCO S&amp;P 500 EQL WGHT ETF","EQL","CAD","ETF","CA","TSE*"
"EQL.F","INVESCO S&amp;P 500 EQL WGHT ETF","EQL.F","CAD","ETF","CA","TSE*"
"EQL.U","INVESCO S&amp;P 500 EQL WGHT ETF","EQL.U","USD","ETF","CA","TSE*"
"ESG","INVESCO S&amp;P 500 ESG INDEX ET","ESG","CAD","ETF","CA","TSE*"
"ESG.F","INVESCO S&amp;P 500 ESG INDEX HG","ESG.F","CAD","ETF","CA","TSE*"
"ESGA","BMO MSCI CANADA ESG LEADERS","ESGA","CAD","ETF","CA","TSE*"
"ESGB","BMO ESG CORPORATE BOND INDEX","ESGB","CAD","ETF","CA","TSE*"
"ESGC","INVESCO S&amp;P/TSX COMP ESG IND","ESGC","CAD","ETF","CA","TSE*"
"ESGE","BMO MSCI EAFE ESG LEADERS IN","ESGE","CAD","ETF","CA","TSE*"
"ESGF","BMO ESG US CORPORATE BOND CA","ESGF","CAD","ETF","CA","TSE*"
"ESGG","BMO MSCI GLOBAL ESG LEADERS","ESGG","CAD","ETF","CA","TSE*"
"ESGH","BMO ESG HIGH YIELD US CORP","ESGH","CAD","ETF","CA","TSE*"
"ESGH.F","BMO ESG HIGH YIELD US CORPOR","ESGH.F","CAD","ETF","CA","TSE*"
"ESGY","BMO MSCI USA ESG LEADERS IND","ESGY","CAD","ETF","CA","TSE*"
"ESGY.F","BMO MSCI USA ESG LD IND-HEDG","ESGY.F","CAD","ETF","CA","TSE*"
"ESPX","EVOLVE S&amp;P 500 ENHANCED FUND","ESPX","CAD","ETF","CA","TSE*"
"ESPX.B","EVOLVE S&amp;P 500 ENHANCED FUND","ESPX.B","CAD","ETF","CA","TSE*"
"ETC","EVOLVE CRYPTOCURRENCIES ETF","ETC","CAD","ETF","CA","TSE*"
"ETC.U","EVOLVE CRYPTOCURRENCIES ETF","ETC.U","USD","ETF","CA","TSE*"
"ETHH","PURPOSE ETHER ETF","ETHH","CAD","ETF","CA","TSE*"
"ETHH.B","PURPOSE ETHER ETF","ETHH.B","CAD","ETF","CA","TSE*"
"ETHH.U","PURPOSE ETHER ETF","ETHH.U","USD","ETF","CA","TSE*"
"ETHI","GLOBAL X GLB SUS LEAD IN ETF","ETHI","CAD","ETF","CA","TSE*"
"ETHI.OLD","HORIZONS GLOBAL SUSTAINABI-A","ETHI.OLD","null","ETF","CA","TSE*"
"ETHQ","3IQ ETHER STAKING ETF","ETHQ","CAD","ETF","CA","TSE*"
"ETHQ.U","3IQ ETHER STAKING ETF","ETHQ.U","USD","ETF","CA","TSE*"
"ETHR","EVOLVE ETHER ETF","ETHR","CAD","ETF","CA","TSE*"
"ETHR.U","EVOLVE ETHER ETF USD","ETHR.U","USD","ETF","CA","TSE*"
"ETHX.B","CI GALAXY ETHEREUM ETF","ETHX.B","CAD","ETF","CA","TSE*"
"ETHX.U","CI GALAXY ETHEREUM ETF USD","ETHX.U","USD","ETF","CA","TSE*"
"ETHY","PURPOSE ETHER YIELD ETF","ETHY","CAD","ETF","CA","TSE*"
"ETHY.B","PURPOSE ETHER YIELD ETF","ETHY.B","CAD","ETF","CA","TSE*"
"ETHY.U","PURPOSE ETHER YIELD ETF","ETHY.U","USD","ETF","CA","TSE*"
"ETP","FIRST TR GL RSK MGD INC","ETP","CAD","ETF","CA","TSE*"
"ETSX","EVOLVE S&amp;P/TSX 60 ENHANCED","ETSX","CAD","ETF","CA","TSE*"
"EVO","EVOVEST GLOBAL EQUITY ETF","EVO","CAD","ETF","CA","TSE*"
"FBAL","FIDELITY ALL IN ONE BALANCED","FBAL","CAD","ETF","CA","AEQLIT*"
"FBGO","FRANKL BW GLB SUS INC OPT-ET","FBGO","CAD","ETF","CA","TSE*"
"FBT","FIRST TRUST NYSE ARCA BIOTEC","FBT","CAD","ETF","CA","TSE*"
"FBTC","FIDELITY ADVANTAGE BITCOIN","FBTC","CAD","ETF","CA","TSE*"
"FBTC.U","FIDELITY ADVANTAGE BITCOIN","FBTC.U","USD","ETF","CA","TSE*"
"FCAM","FIDELITY ALL-AMER EQUITY","FCAM","CAD","ETF","CA","AEQLIT*"
"FCCA","FIDELITY ALL-CA EQUITY ETF","FCCA","CAD","ETF","CA","AEQLIT*"
"FCCB","FIDELITY SYSTEMATIC CANADIAN","FCCB","CAD","ETF","CA","AEQLIT*"
"FCCD","FIDELITY CANADIAN HIGH DIVID","FCCD","CAD","ETF","CA","TSE*"
"FCCL","FIDELITY CANADIAN LOW VOLATI","FCCL","CAD","ETF","CA","AEQLIT*"
"FCCM","FIDELITY CANADIAN MOMENTUM E","FCCM","CAD","ETF","CA","AEQLIT*"
"FCCQ","FIDELITY CANADIAN HIGH QUALI","FCCQ","CAD","ETF","CA","TSE*"
"FCCV","FIDELITY CANADIAN VALUE ETF","FCCV","CAD","ETF","CA","TSE*"
"FCEM","FIDELITY EM FD - ETF SERIES","FCEM","CAD","ETF","CA","TSE*"
"FCGB","FIDELITY GLOBAL CORE PLUS BO","FCGB","CAD","ETF","CA","AEQLIT*"
"FCGC","FIDELITY GREATER CANADA-ETF","FCGC","CAD","ETF","CA","AEQLIT*"
"FCGI","FIDELITY GBL MONTHLY HIGH IN","FCGI","CAD","ETF","CA","TSE*"
"FCGS","FIDELITY GL SM CAP OPP ETF","FCGS","CAD","ETF","CA","AEQLIT*"
"FCID","FIDELITY INTERNATIONAL HIGH","FCID","CAD","ETF","CA","TSE*"
"FCIG","FIDELITY GLOBAL INV GR BOND","FCIG","CAD","ETF","CA","AEQLIT*"
"FCII","FRANK CB-SUST GLB INF IN-ETF","FCII","CAD","ETF","CA","TSE*"
"FCIL","FIDELITY INTERNATIONAL LOW V","FCIL","CAD","ETF","CA","AEQLIT*"
"FCIM","FIDELITY INTERNATIONAL MOMEN","FCIM","CAD","ETF","CA","AEQLIT*"
"FCIN","FIDELITY ALL-INT EQUITY","FCIN","CAD","ETF","CA","AEQLIT*"
"FCIQ","FIDELITY INTERNATIONAL HIGH","FCIQ","CAD","ETF","CA","TSE*"
"FCIV","FIDELITY INTERNATIONAL VALUE","FCIV","CAD","ETF","CA","TSE*"
"FCLC","FIDELITY CND LARGE CAP ETF","FCLC","CAD","ETF","CA","AEQLIT*"
"FCLH","FIDELITY US LOW VOLATILITY C","FCLH","CAD","ETF","CA","AEQLIT*"
"FCLS","FIDELITY CA L/S ALT-ETF","FCLS","CAD","ETF","CA","AEQLIT*"
"FCMH","FIDELITY US MOMENTUM CURRENC","FCMH","CAD","ETF","CA","AEQLIT*"
"FCMI","FIDELITY CA MONTHLY HIGH INC","FCMI","CAD","ETF","CA","TSE*"
"FCMO","FIDELITY US MOMENTUM ETF","FCMO","CAD","ETF","CA","AEQLIT*"
"FCNS","FIDELITY ALL IN ONE CONS","FCNS","CAD","ETF","CA","AEQLIT*"
"FCQH","FIDELITY US HIGH QUALITY CUR","FCQH","CAD","ETF","CA","TSE*"
"FCRH","FIDELITY US DIVIDEND FOR RIS","FCRH","CAD","ETF","CA","TSE*"
"FCRR","FIDELITY US DIVIDEND FOR RIS","FCRR","CAD","ETF","CA","TSE*"
"FCSB","FIDELITY CANADIAN SHORT TERM","FCSB","CAD","ETF","CA","AEQLIT*"
"FCSI","FRANK CLEAR BRI SUS IGF-ETF","FCSI","CAD","ETF","CA","TSE*"
"FCSW","FIDELITY SUSTAIN WORLD ETF","FCSW","CAD","ETF","CA","AEQLIT*"
"FCUD","FIDELITY US HIGH DIVIDEND ET","FCUD","CAD","ETF","CA","TSE*"
"FCUH","FIDELITY US HIGH DIVIDEND CU","FCUH","CAD","ETF","CA","TSE*"
"FCUL","FIDELITY US LOW VOLATILITY E","FCUL","CAD","ETF","CA","AEQLIT*"
