SYMBOL,DESCRIPTION,IBKR-SYMBOL,CURRENCY,PRODUCT,REGION,EXCHANGE
"FRI","FIRST TRUST S&amp;P REIT INDEX F","FRI","USD","ETF","US","ARCA*"
"FRNW","FIDELITY CLEAN ENERGY ETF","FRNW","USD","ETF","US","BATS*"
"FRTY","ALGER MID CAP 40 ETF","FRTY","USD","ETF","US","ARCA*"
"FSBD","FIDELITY SUSTAINABLE CORE PL","FSBD","USD","ETF","US","ARCA*"
"FSEC","FIDELITY INV GRADE SECURIT","FSEC","USD","ETF","US","ARCA*"
"FSEP","FT VEST U.S. EQUITY BUFFER E","FSEP","USD","ETF","US","BATS*"
"FSIG","FT LTD DURATION INV GRADE","FSIG","USD","ETF","US","ARCA*"
"FSLD","FIDELITY SUST LOW DUR ETF","FSLD","USD","ETF","US","ARCA*"
"FSMB","FIRST TRUST SHORT DUR MANAG","FSMB","USD","ETF","US","ARCA*"
"FSMD","FIDELITY SMALL-MID MULTIFACT","FSMD","USD","ETF","US","ARCA*"
"FSST","FIDELITY SUSTAINABLE U.S. EQ","FSST","USD","ETF","US","ARCA*"
"FSTA","FIDELITY CON STAPLES ETF","FSTA","USD","ETF","US","ARCA*"
"FSYD","FIDELITY SUSTAINABLE HY ETF","FSYD","USD","ETF","US","ARCA*"
"FSZ","FIRST TRUST SWITZERLAND","FSZ","USD","ETF","US","NASDAQ*"
"FTA","FIRST TRUST L C VAL ALP","FTA","USD","ETF","US","NASDAQ*"
"FTA","FIRST TRUST L C VAL ALP","FTA","MXN","ETF","US","MEXI*"
"FTAG","FIRST TRUST INDXX GLOBAL AGR","FTAG","USD","ETF","US","NASDAQ*"
"FTBD","FIDELITY TACTICAL BOND ETF","FTBD","USD","ETF","US","ARCA*"
"FTC","FIRST TRUST LARGE CAP GROWTH","FTC","USD","ETF","US","NASDAQ*"
"FTC","FIRST TRUST LARGE CAP GROWTH","FTC","MXN","ETF","US","MEXI*"
"FTCB","FT CORE INVESTMENT GRADE ETF","FTCB","USD","ETF","US","ARCA*"
"FTCS","FIRST TRUST CAPITAL STRENGTH","FTCS","USD","ETF","US","NASDAQ*"
"FTCS","FIRST TRUST CAPITAL STRENGTH","FTCS","MXN","ETF","US","MEXI*"
"FTDS","FIRST TRUST DIVIDEND STRENGT","FTDS","USD","ETF","US","NASDAQ*"
"FTEC","FIDELITY MSCI INFO TECH ETF","FTEC","USD","ETF","US","ARCA*"
"FTGC","FIRST TRUST GLOBAL TACTICAL","FTGC","USD","ETF","US","NASDAQ*"
"FTGS","FIRST TRUST GRWTH STRGTH ETF","FTGS","USD","ETF","US","NASDAQ*"
"FTHF","FT EM HUMAN FLOURISHING ETF","FTHF","USD","ETF","US","ARCA*"
"FTHI","FTHI/FIRST TRUST EXCHANGE-TR","FTHI","USD","ETF","US","NASDAQ*"
"FTIF","FT BBG INFL SENSITIVE EQ ETF","FTIF","USD","ETF","US","ARCA*"
"FTLS","FIRST TRUST LONG/SHORT EQTY","FTLS","USD","ETF","US","ARCA*"
"FTQI","FIRST TRUST NASDAQ BUYWRITE","FTQI","USD","ETF","US","NASDAQ*"
"FTRB","FEDERATED HERM TTL RTRN BND","FTRB","USD","ETF","US","ARCA*"
"FTRI","FIRST TRUST INDXX GLOBAL NAT","FTRI","USD","ETF","US","NASDAQ*"
"FTSD","FRANKLIN SHORT DURATION U.S.","FTSD","USD","ETF","US","ARCA*"
"FTSL","FIRST TRUST SENIOR LOAN ETF","FTSL","USD","ETF","US","NASDAQ*"
"FTSM","FIRST TRUST ENH SHORT MAT FD","FTSM","USD","ETF","US","NASDAQ*"
"FTWO","STRIVE FAANG 2.0 ETF","FTWO","USD","ETF","US","NYSE*"
"FTXG","FIRST TRUST NASDAQ FOOD &amp; BE","FTXG","USD","ETF","US","NASDAQ*"
"FTXH","FIRST TRUST NASDAQ PHARMACEU","FTXH","USD","ETF","US","NASDAQ*"
"FTXL","FIRST TRUST NASDAQ SEMICONDU","FTXL","USD","ETF","US","NASDAQ*"
"FTXN","FIRST TRUST NASDAQ OIL &amp; GAS","FTXN","USD","ETF","US","NASDAQ*"
"FTXO","FIRST TRUST NASDAQ BANK ETF","FTXO","USD","ETF","US","NASDAQ*"
"FTXO","FIRST TRUST NASDAQ BANK ETF","FTXO","MXN","ETF","US","MEXI*"
"FTXR","FIRST TRUST NASDAQ TRANSPORT","FTXR","USD","ETF","US","NASDAQ*"
"FUMB","FIRST TRUST ULTRA SHORT DUR","FUMB","USD","ETF","US","ARCA*"
"FUNL","CORNERCAP FUNDAMETRICS LARGE","FUNL","USD","ETF","US","BATS*"
"FUSI","AM CENT MULTISECT FLOAT INC","FUSI","USD","ETF","US","ARCA*"
"FUTY","FIDELITY US UTILITIES ETF","FUTY","USD","ETF","US","ARCA*"
"FV","FIRST TRUST DW FOCUS 5 FUND","FV","USD","ETF","US","NASDAQ*"
"FV","FIRST TRUST DW FOCUS 5 FUND","FV","MXN","ETF","US","MEXI*"
"FVAL","FIDELITY VALUE FACTOR ETF","FVAL","USD","ETF","US","ARCA*"
"FVC","FIRST TRUST DORSEY WRIGHT DY","FVC","USD","ETF","US","NASDAQ*"
"FVD","FIRST TRUST VALUE LINE DVD","FVD","USD","ETF","US","ARCA*"
"FVD","FIRST TRUST VALUE LINE DVD","FVD","MXN","ETF","US","MEXI*"
"FWD","AB DISRUPTORS ETF","FWD","USD","ETF","US","ARCA*"
"FXA","INVESCO CURRENCYSHARES AUSTR","FXA","USD","ETF","US","ARCA*"
"FXB","INVESCO CURRENCYSHARES BRITI","FXB","USD","ETF","US","ARCA*"
"FXC","INVESCO CURRENCYSHARES CANAD","FXC","MXN","ETF","US","MEXI*"
"FXC","INVESCO CURRENCYSHARES CANAD","FXC","USD","ETF","US","ARCA*"
"FXD","FIRST TRUST CONSUMER DISCRET","FXD","MXN","ETF","US","MEXI*"
"FXD","FIRST TRUST CONSUMER DISCRET","FXD","USD","ETF","US","ARCA*"
"FXE","INVESCO CURRENCYSHARES EURO","FXE","USD","ETF","US","ARCA*"
"FXED","SOUND ENHANCED FIXED INCOME","FXED","USD","ETF","US","ARCA*"
"FXF","INVESCO CURRENCYSHARES SWISS","FXF","USD","ETF","US","ARCA*"
"FXG","FIRST TRUST CONSUMER STAPLES","FXG","MXN","ETF","US","MEXI*"
"FXG","FIRST TRUST CONSUMER STAPLES","FXG","USD","ETF","US","ARCA*"
"FXH","FIRST TRUST HEALTH CARE ALPH","FXH","USD","ETF","US","ARCA*"
"FXH","FIRST TRUST HEALTH CARE ALPH","FXH","MXN","ETF","US","MEXI*"
"FXI","ISHARES CHINA LARGE-CAP ETF","FXI","USD","ETF","US","ARCA*"
"FXI","ISHARES CHINA LARGE-CAP ETF","FXI","MXN","ETF","US","MEXI*"
"FXL","FIRST TRUST TECHNOLOGY ALPHA","FXL","USD","ETF","US","ARCA*"
"FXL","FIRST TRUST TECHNOLOGY ALPHA","FXL","MXN","ETF","US","MEXI*"
"FXN","FIRST TRUST ENERGY ALPHADEX","FXN","USD","ETF","US","ARCA*"
"FXN","FIRST TRUST ENERGY ALPHADEX","FXN","MXN","ETF","US","MEXI*"
"FXO","FIRST TRUST FINANCIAL ALPHAD","FXO","USD","ETF","US","ARCA*"
"FXO","FIRST TRUST FINANCIAL ALPHAD","FXO","MXN","ETF","US","MEXI*"
"FXP","PROSHARES ULTRASHORT FTSE CH","FXP","USD","ETF","US","ARCA*"
"FXR","FIRST TRUST INDST/PRODUCERS","FXR","USD","ETF","US","ARCA*"
"FXR","FIRST TRUST INDST/PRODUCERS","FXR","MXN","ETF","US","MEXI*"
"FXU","FIRST TRUST UTILITIES ALPHAD","FXU","USD","ETF","US","ARCA*"
"FXU","FIRST TRUST UTILITIES ALPHAD","FXU","MXN","ETF","US","MEXI*"
"FXY","INVESCO CURRENCYSHARES JAPAN","FXY","USD","ETF","US","ARCA*"
"FXZ","FIRST TRUST MATERIALS ALPHAD","FXZ","USD","ETF","US","ARCA*"
"FXZ","FIRST TRUST MATERIALS ALPHAD","FXZ","MXN","ETF","US","MEXI*"
"FYC","FIRST TRUST SMALL CAP GROWTH","FYC","USD","ETF","US","NASDAQ*"
"FYC","FIRST TRUST SMALL CAP GROWTH","FYC","MXN","ETF","US","MEXI*"
"FYEE","FIDELITY YIELD ENHANCED EQTY","FYEE","USD","ETF","US","BATS*"
"FYLD","CAMBRIA FOREIGN SHAREHOLDER","FYLD","USD","ETF","US","BATS*"
"FYLG","GLOBAL X FIN COV CALL &amp; GR","FYLG","USD","ETF","US","ARCA*"
"FYLG","GLOBAL X FIN COV CALL &amp; GR","FYLG","MXN","ETF","US","MEXI*"
"FYT","FIRST TRUST SMALL CAP VAL","FYT","USD","ETF","US","NASDAQ*"
"FYX","FIRST TRUST SMALL CAP CORE A","FYX","USD","ETF","US","NASDAQ*"
"FYX","FIRST TRUST SMALL CAP CORE A","FYX","MXN","ETF","US","MEXI*"
"GAA","CAMBRIA GLOBAL ASSET ALLOCAT","GAA","USD","ETF","US","BATS*"
"GABF","GABELLI FIN SRVCS OPP ETF","GABF","USD","ETF","US","ARCA*"
"GAL","SPDR SSGA GLOBAL ALLOCATION","GAL","USD","ETF","US","ARCA*"
"GAMR","AMPLIFY VIDEO GAME TECH ETF","GAMR","USD","ETF","US","ARCA*"
"GAPR","FT VEST US EQUITY MODERATE B","GAPR","USD","ETF","US","BATS*"
"GAST","GABELLI AUTOMATION ETF","GAST","USD","ETF","US","ARCA*"
"GAUG","FT VEST US EQUITY MODERATE B","GAUG","USD","ETF","US","BATS*"
"GBF","ISHARES GOVERNMENT/CREDIT BO","GBF","USD","ETF","US","ARCA*"
"GBIL","GOLDMAN SACHS ACCESS TREASUR","GBIL","USD","ETF","US","ARCA*"
"GBLD","INVESCO MSCI BUILDING ETF","GBLD","USD","ETF","US","ARCA*"
"GBTC","GRAYSCALE BITCOIN TRUST BTC","GBTC","USD","ETF","US","ARCA*"
"GBUY","GOLDMAN SACHS FUT CONSUMER","GBUY","USD","ETF","US","ARCA*"
"GCAD","GABELLI COMMERCIAL AEROSPACE","GCAD","USD","ETF","US","ARCA*"
"GCC","WISDOMTREE ENHANCED COMMODIT","GCC","USD","ETF","US","ARCA*"
"GCLN","GS BLOOMBERG CLEAN ENERGY","GCLN","USD","ETF","US","BATS*"
"GCOR","GOLDMAN SACHS ACCESS US AGG","GCOR","USD","ETF","US","ARCA*"
"GCOW","PACER GLOBAL CASH COWS DIVID","GCOW","USD","ETF","US","BATS*"
"GDE","WISDOMTREE EFFICIENT GOLD PL","GDE","USD","ETF","US","BATS*"
"GDEC","FT VEST US EQUITY MODERATE B","GDEC","USD","ETF","US","BATS*"
"GDEF","GS DEFENSIVE EQUITY ETF","GDEF","USD","ETF","US","ARCA*"
"GDIV","HARBOR DIVIDEND GROWTH LEADE","GDIV","USD","ETF","US","NYSE*"
"GDMA","GADSDEN DYNAMIC MULTI-ASSET","GDMA","USD","ETF","US","BATS*"
"GDMN","WISDOMTREE EFF GOLD PL MINER","GDMN","USD","ETF","US","BATS*"
"GDOC","GOLDMAN SACHS FUTURE HEALTH","GDOC","USD","ETF","US","ARCA*"
"GDVD","COPPER PLACE GLOBAL DIVIDEND","GDVD","USD","ETF","US","ARCA*"
