SYMBOL,DESCRIPTION,IBKR-SYMBOL,CURRENCY,PRODUCT,REGION,EXCHANGE
"GDX","VANECK GOLD MINERS ETF","GDX","USD","ETF","US","ARCA*"
"GDXD","MICROSECTORS GOLD MINERS -3X","GDXD","USD","ETF","US","ARCA*"
"GDXD.OLD","MICROSECTORS GOLD MINERS -3X","GDXD.OLD","null","ETF","US","ARCA*"
"GDXJ","VANECK JUNIOR GOLD MINERS","GDXJ","USD","ETF","US","ARCA*"
"GDXU","MICROSECTORS GOLD MINERS 3X","GDXU","USD","ETF","US","ARCA*"
"GDXY","YLDMAX GOLD MIN OP IN ST ETF","GDXY","USD","ETF","US","ARCA*"
"GEM","GOLDMAN SACHS ACTIVEBETA EM","GEM","USD","ETF","US","ARCA*"
"GEM","GOLDMAN SACHS ACTIVEBETA EM","GEM","MXN","ETF","US","MEXI*"
"GEMD","GOLDMAN ACCESS EM USD BOND","GEMD","USD","ETF","US","BATS*"
"GENM","GENTER CAPITAL MUNICIPAL","GENM","USD","ETF","US","ARCA*"
"GENT","GENTER CAPITAL TAXABLE","GENT","USD","ETF","US","ARCA*"
"GENY","PRINCIPAL MILLENNIALS ETF","GENY","MXN","ETF","US","MEXI*"
"GEQ1","INVESCO NASDAQ NEXT GEN 100","GEQ1","EUR","ETF","US","GETTEX*"
"GERM","AMPLIFY TREAT TEST AND ADVA","GERM","USD","ETF","US","ARCA*"
"GFEB","FT VEST US EQUITY MODERATE B","GFEB","USD","ETF","US","BATS*"
"GFGF","GURU FAVORITE STOCKS ETF","GFGF","USD","ETF","US","NASDAQ*"
"GFOF","GRAYSCALE FUTURE OF FINANCE","GFOF","USD","ETF","US","ARCA*"
"GGLL","DIREXION DAILY GOOGL BULL 2X","GGLL","USD","ETF","US","NASDAQ*"
"GGLS","DIREXION DAILY GOOGL BEAR 1X","GGLS","USD","ETF","US","NASDAQ*"
"GGM","GGM MACRO ALIGNMENT ETF","GGM","USD","ETF","US","ARCA*"
"GGME","INVESCO NEXT GEN MEDIA AND G","GGME","USD","ETF","US","ARCA*"
"GGRW","GABELLI GLOBAL GROWTH ETF","GGRW","USD","ETF","US","ARCA*"
"GGUS","GOLDMAN SS MB RL 1000 GE ETF","GGUS","USD","ETF","US","ARCA*"
"GHEE","GH ENHANCED EQTY ETF","GHEE","USD","ETF","US","BATS*"
"GHMS","GOOSE HLW MULT STRAT INC ETF","GHMS","USD","ETF","US","BATS*"
"GHTA","GOOSE HOLLOW TACTICAL ALLOC","GHTA","USD","ETF","US","BATS*"
"GHYB","GOLDMAN SACHS ACCESS HY CORP","GHYB","USD","ETF","US","ARCA*"
"GHYB","GOLDMAN SACHS ACCESS HY CORP","GHYB","MXN","ETF","US","MEXI*"
"GHYG","ISHARES US&amp;INTL HIGH YIELD C","GHYG","USD","ETF","US","BATS*"
"GIGB","GOLDMAN SACHS INV GRD CORP","GIGB","USD","ETF","US","ARCA*"
"GIGB","GOLDMAN SACHS INV GRD CORP","GIGB","MXN","ETF","US","MEXI*"
"GII","SPDR S&amp;P GLOBAL INFRASTRUCTU","GII","USD","ETF","US","ARCA*"
"GINN","GOLDMAN SACHS INNOVATE EQTY","GINN","USD","ETF","US","ARCA*"
"GINN","GOLDMAN SACHS INNOVATE EQTY","GINN","MXN","ETF","US","MEXI*"
"GINX","SGI ENH GL INC ETF","GINX","USD","ETF","US","NASDAQ*"
"GJAN","FT VEST US EQUITY MODERATE B","GJAN","USD","ETF","US","BATS*"
"GJUL","FT VEST US EQUITY MODERATE B","GJUL","USD","ETF","US","BATS*"
"GJUN","FT VEST US EQUITY MODERATE B","GJUN","USD","ETF","US","BATS*"
"GK","ADVISORSHARES GERBER KAWASAK","GK","USD","ETF","US","ARCA*"
"GLD","SPDR GOLD SHARES","GLD","USD","ETF","US","ARCA*"
"GLDI","X-LINKS GOLD SHRS COVRD CALL","GLDI","USD","ETF","US","NASDAQ*"
"GLDM","SPDR GOLD MINISHARES TRUST","GLDM","MXN","ETF","US","MEXI*"
"GLDM","SPDR GOLD MINISHARES TRUST","GLDM","USD","ETF","US","ARCA*"
"GLIN","VANECK INDIA GROWTH LEADERS","GLIN","USD","ETF","US","ARCA*"
"GLL","PROSHARES ULTRASHORT GOLD","GLL","USD","ETF","US","ARCA*"
"GLOF","ISHARES GLOBAL EQUITY FACTOR","GLOF","MXN","ETF","US","MEXI*"
"GLOF","ISHARES GLOBAL EQUITY FACTOR","GLOF","USD","ETF","US","ARCA*"
"GLOV","GS ACTIVE BETA WORLD LVOL PL","GLOV","USD","ETF","US","BATS*"
"GLRY","INSPIRE MOMTU ETF - USD INC","GLRY","USD","ETF","US","ARCA*"
"GLTR","ABRDN PHYSICAL PRECIOUS MET","GLTR","USD","ETF","US","ARCA*"
"GMAR","FT VEST US EQUITY MODERATE B","GMAR","USD","ETF","US","BATS*"
"GMAY","FT VEST U.S. EQUITY MODERATE","GMAY","USD","ETF","US","BATS*"
"GMET","VANECK GREEN METALS","GMET","USD","ETF","US","ARCA*"
"GMF","SPDR S&amp;P EMERGING ASIA PACIF","GMF","USD","ETF","US","ARCA*"
"GMOM","CAMBRIA GLOBAL MOMENTUM ETF","GMOM","USD","ETF","US","BATS*"
"GMUN","GS COMMUNITY MUNI BOND ETF","GMUN","USD","ETF","US","ARCA*"
"GNMA","ISHARES GNMA BOND ETF","GNMA","USD","ETF","US","NASDAQ*"
"GNOM","GLOBAL X GENOMICS &amp; BIOTECHN","GNOM","USD","ETF","US","NASDAQ*"
"GNOM","GLOBAL X GENOMICS &amp; BIOTECHN","GNOM","MXN","ETF","US","MEXI*"
"GNOV","FT VEST US EQUITY MODERATE B","GNOV","USD","ETF","US","BATS*"
"GNR","SPDR S&amp;P GL NAT RESOURCES","GNR","USD","ETF","US","ARCA*"
"GNR","SPDR S&amp;P GL NAT RESOURCES","GNR","MXN","ETF","US","MEXI*"
"GOAT","VANECK MSTAR GL WIDE MOAT","GOAT","MXN","ETF","US","MEXI*"
"GOAU","US GLB GLD &amp; METAL MNRS ETF","GOAU","USD","ETF","US","ARCA*"
"GOAU","US GLB GLD &amp; METAL MNRS ETF","GOAU","MXN","ETF","US","MEXI*"
"GOCT","FT VEST US EQUITY MODERATE B","GOCT","USD","ETF","US","BATS*"
"GOEX","GLOBAL X GOLD EXPLORERS ETF","GOEX","USD","ETF","US","ARCA*"
"GOEX","GLOBAL X GOLD EXPLORERS ETF","GOEX","MXN","ETF","US","MEXI*"
"GOLY","STRATEGY SHARES GLD HDG BOND","GOLY","USD","ETF","US","BATS*"
"GOOP","KURV YLD PREM STR GOOGL ETF","GOOP","USD","ETF","US","BATS*"
"GOOX","T-REX 2X LNG ALPHABET DLY","GOOX","USD","ETF","US","BATS*"
"GOOY","YIELDMAX GOOGL OPTION INCOME","GOOY","USD","ETF","US","ARCA*"
"GOVI","INVESCO EQUAL WEIGHT 0-30 YR","GOVI","USD","ETF","US","NASDAQ*"
"GOVT","ISHARES US TREASURY BOND ETF","GOVT","USD","ETF","US","BATS*"
"GOVT","ISHARES US TREASURY BOND ETF","GOVT","MXN","ETF","US","MEXI*"
"GOVZ","ISHARES 25+ YR TREAS STRIPS","GOVZ","USD","ETF","US","BATS*"
"GPIQ","NASDAQ 100 CORE PREM INC ETF","GPIQ","USD","ETF","US","NASDAQ*"
"GPIX","S&amp;P 500 CORE PREMIUM INCOME","GPIX","USD","ETF","US","NASDAQ*"
"GPOW","GS NRTH AMER PIPELNE AND POW","GPOW","USD","ETF","US","BATS*"
"GQ9","SPDR GOLD SHARES","GQ9","EUR","ETF","US","SWB*"
"GQI","NATIXIS GATEWAY QUALITY INC","GQI","USD","ETF","US","ARCA*"
"GQRE","FLEXSHARES GLOBAL QUALITY RE","GQRE","USD","ETF","US","ARCA*"
"GREI","GOLDMAN SACHS FUT REAL ESTAT","GREI","USD","ETF","US","ARCA*"
"GREK","GLOBAL X MSCI GREECE ETF","GREK","USD","ETF","US","ARCA*"
"GREK","GLOBAL X MSCI GREECE ETF","GREK","MXN","ETF","US","MEXI*"
"GRID","FIRST TRST NASD CL EDG SGIIF","GRID","USD","ETF","US","NASDAQ*"
"GRID","FIRST TRST NASD CL EDG SGIIF","GRID","MXN","ETF","US","MEXI*"
"GRN","IPATH SERIES B CARBON ETN","GRN","USD","ETF","US","ARCA*"
"GRNB","VANECK GREEN BOND ETF","GRNB","USD","ETF","US","ARCA*"
"GRNB","VANECK GREEN BOND ETF","GRNB","MXN","ETF","US","MEXI*"
"GRNR","GLOBAL X GREEN BUILDING ETF","GRNR","MXN","ETF","US","MEXI*"
"GRPM","INVESCO S&amp;P MIDCAP 400 GARP","GRPM","USD","ETF","US","ARCA*"
"GRPZ","INVESCO S&amp;P SC 600 GARP ETF","GRPZ","USD","ETF","US","ARCA*"
"GRW","TCW COMPOUNDERS ETF","GRW","USD","ETF","US","ARCA*"
"GSC","SMALL CAP CORE EQUITY ETF","GSC","USD","ETF","US","ARCA*"
"GSD","SPDR GOLD SHARES","GSD","SGD","ETF","US","SGX*"
"GSEE","GOLDMAN SACHS MARKETBETA EME","GSEE","USD","ETF","US","BATS*"
"GSEP","FT VEST US EQUITY MODERATE B","GSEP","USD","ETF","US","BATS*"
"GSEU","GOLDMAN ACTIVEBTA EUR EQ ETF","GSEU","USD","ETF","US","ARCA*"
"GSEW","GOLDMAN SACHS EQL WGHT LARGE","GSEW","USD","ETF","US","BATS*"
"GSFP","GS FUTURE PLANET EQUITY ETF","GSFP","USD","ETF","US","ARCA*"
"GSG","ISHARES S&amp;P GSCI COMMODITY I","GSG","USD","ETF","US","ARCA*"
"GSIB","THEMES GLOBAL SYSTEMICALLY","GSIB","USD","ETF","US","NASDAQ*"
"GSID","GOLDMAN SACHS MARKETBETA INT","GSID","USD","ETF","US","BATS*"
"GSIE","GOLDMAN SACHS ACTIVEBETA INT","GSIE","MXN","ETF","US","MEXI*"
"GSIE","GOLDMAN SACHS ACTIVEBETA INT","GSIE","USD","ETF","US","ARCA*"
"GSIG","GOLDMAN SACHS ACCESS INVESTM","GSIG","USD","ETF","US","ARCA*"
"GSJY","GOLDMAN ACTIVEBETA JP EQ ETF","GSJY","USD","ETF","US","ARCA*"
"GSLC","GOLDMAN ACTIVEBETA US LC ETF","GSLC","USD","ETF","US","ARCA*"
"GSLC","GOLDMAN ACTIVEBETA US LC ETF","GSLC","MXN","ETF","US","MEXI*"
"GSPY","GOTHAM ENHANCED 500 ETF","GSPY","USD","ETF","US","ARCA*"
"GSSC","GOLDMAN SACHS ACTIVEBETA US","GSSC","USD","ETF","US","ARCA*"
"GSST","GOLDMAN SACHS ACCESS U/SHORT","GSST","USD","ETF","US","BATS*"
"GSUS","GOLDMAN SACHS MARKETBETA US","GSUS","USD","ETF","US","BATS*"
"GSY","INVESCO ULTRA SHORT DURATION","GSY","USD","ETF","US","ARCA*"
"GTEK","GS FUTURE TECH LEADERS EQ","GTEK","USD","ETF","US","ARCA*"
"GTIP","GOLDMAN SACHS ACCESS INFLATI","GTIP","USD","ETF","US","BATS*"
"GTO","INVESCO TOTAL RETURN BOND ET","GTO","USD","ETF","US","ARCA*"
"GTR","WISDOMTREE TARGET RANGE FUND","GTR","USD","ETF","US","NASDAQ*"
"GUNR","FLEXSHARES GLOBAL UPSTREAM N","GUNR","USD","ETF","US","ARCA*"
"GURU","GLOBAL X GURU INDEX ETF","GURU","USD","ETF","US","ARCA*"
"GUSA","GOLDMAN SACHS MARKETBETA US","GUSA","USD","ETF","US","ARCA*"
"GUSH","DIREXION DAILY S&amp;P OIL &amp; GAS","GUSH","MXN","ETF","US","MEXI*"
"GUSH","DIREXION DAILY S&amp;P OIL &amp; GAS","GUSH","USD","ETF","US","ARCA*"
"GVAL","CAMBRIA GLOBAL VALUE ETF","GVAL","USD","ETF","US","BATS*"
"GVI","ISHARES INTERMEDIATE GOVERNM","GVI","USD","ETF","US","BATS*"
"GVIP","GOLD SACHS HEDGE IND VIP ETF","GVIP","USD","ETF","US","ARCA*"
"GVLU","GOTHAM 1000 VALUE ETF","GVLU","USD","ETF","US","ARCA*"
"GVUS","GOLDMAN SACHS MB R1000 VAL","GVUS","USD","ETF","US","ARCA*"
"GWX","SPDR S&amp;P INTL SMALL CAP","GWX","USD","ETF","US","ARCA*"
"GXC","SPDR S&amp;P CHINA ETF","GXC","USD","ETF","US","ARCA*"
"GXG","GLOBAL X MSCI COLOMBIA ETF","GXG","USD","ETF","US","ARCA*"
"GXTG","GLOBAL X THEMATIC GROWTH ETF","GXTG","USD","ETF","US","NASDAQ*"
"GXTG","GLOBAL X THEMATIC GROWTH ETF","GXTG","MXN","ETF","US","MEXI*"
"GXUS","GOLDMAN SACHS MB TOT INT ETF","GXUS","USD","ETF","US","ARCA*"
"GYLD","ARROW DOW JONES GLOBAL YIELD","GYLD","USD","ETF","US","NYSE*"
"HACK","AMPLIFY CYBERSECURITY ETF","HACK","USD","ETF","US","ARCA*"
"HAIL","SPDR S&amp;P KENSHO SMART MOBILI","HAIL","USD","ETF","US","ARCA*"
"HAIL","SPDR S&amp;P KENSHO SMART MOBILI","HAIL","MXN","ETF","US","MEXI*"
"HAO","INVESCO CHINA SMALL CAP ETF","HAO","MXN","ETF","US","MEXI*"
"HAP","VANECK NATURAL RESOURCES ETF","HAP","USD","ETF","US","ARCA*"
"HAPI","HARBOR HUMAN CAPITAL FACTOR","HAPI","USD","ETF","US","ARCA*"
"HAPR","INNOVATOR PI 9 BUF ETF - APR","HAPR","USD","ETF","US","BATS*"
"HAPS","HARBOR HUMAN CAPITAL FACTOR","HAPS","USD","ETF","US","ARCA*"
"HAPY","HARBOR HUMAN CAPITAL FACTOR","HAPY","MXN","ETF","US","MEXI*"
"HAPY","HARBOR HUMAN CAPITAL FACTOR","HAPY","USD","ETF","US","ARCA*"
"HARD","SIMPLIFY COMMODITIES STR K-1","HARD","USD","ETF","US","ARCA*"
"HART","IQ HEALTHY HEARTS ETF","HART","USD","ETF","US","ARCA*"
"HAUS","RESIDENTIAL REIT ETF","HAUS","USD","ETF","US","BATS*"
"HAUZ","XTRACKERS INTL REAL ESTATE","HAUZ","USD","ETF","US","ARCA*"
"HAWX","ISHARES CUR HDG MSCI ACWI-X","HAWX","USD","ETF","US","ARCA*"
"HCMT","DIREXION HCM TACTIC US ETF","HCMT","USD","ETF","US","ARCA*"
"HCOM","HARTFORD SCHRODERS COMMODITY","HCOM","USD","ETF","US","ARCA*"
"HCOW","AMPLIFY CSH FL H/I ETF","HCOW","USD","ETF","US","NASDAQ*"
"HCRB","HARTFORD CORE BOND ETF","HCRB","USD","ETF","US","BATS*"
"HDAW","XTRACKERS MSCI ALL WORLD EX","HDAW","USD","ETF","US","ARCA*"
"HDEF","XTRACKERS MSCI EAFE HIGH DIV","HDEF","USD","ETF","US","ARCA*"
"HDG","PROSHARES HEDGE REPLICAT ETF","HDG","USD","ETF","US","ARCA*"
"HDGE","ADVISORSHARES RANGER EQ BEAR","HDGE","USD","ETF","US","ARCA*"
"HDLB","ETRACS 2X HI DIV L-VOL ETN-B","HDLB","USD","ETF","US","ARCA*"
"HDMV","FT HORIZON MGD VOL D INT ETF","HDMV","USD","ETF","US","ARCA*"
"HDRO","DEFIANCE NEXT GEN H2 ETF","HDRO","MXN","ETF","US","MEXI*"
"HDRO","DEFIANCE NEXT GEN H2 ETF","HDRO","USD","ETF","US","ARCA*"
"HDUS","HARTFORD DISCIP EQTY ETF","HDUS","USD","ETF","US","ARCA*"
"HDV","ISHARES CORE HIGH DIVIDEND E","HDV","USD","ETF","US","ARCA*"
"HDV","ISHARES CORE HIGH DIVIDEND E","HDV","MXN","ETF","US","MEXI*"
"HEAT","TOUCHSTONE CLMT TRANSETF","HEAT","USD","ETF","US","BATS*"
"HEDJ","WISDOMTREE EUROPE HEDGED EQU","HEDJ","USD","ETF","US","ARCA*"
"HEEM","ISHARES CRNCY HEDGD MSCI EM","HEEM","USD","ETF","US","BATS*"
"HEEM","ISHARES CRNCY HEDGD MSCI EM","HEEM","MXN","ETF","US","MEXI*"
"HEFA","ISHA CURR HEDGED MSCI EAFE","HEFA","MXN","ETF","US","MEXI*"
"HEFA","ISHA CURR HEDGED MSCI EAFE","HEFA","USD","ETF","US","BATS*"
"HEGD","SWAN HEDGED EQUITY US LG CAP","HEGD","USD","ETF","US","BATS*"
"HELO","JPMORGAN HEDGED EQUITY ETF","HELO","USD","ETF","US","ARCA*"
"HELX","FRANKLIN GENOMIC ADVANCEMENT","HELX","USD","ETF","US","BATS*"
"HEQT","SIMPLIFY HEDGED EQUITY ETF","HEQT","USD","ETF","US","ARCA*"
"HERD","PACER CASH COWS FUND OF FUND","HERD","USD","ETF","US","NASDAQ*"
"HERO","GLOBAL X VIDEO GAMES&amp; ESPORT","HERO","USD","ETF","US","NASDAQ*"
"HERO","GLOBAL X VIDEO GAMES&amp; ESPORT","HERO","MXN","ETF","US","MEXI*"
"HEWG","ISHA HEDGED MSCI GERMANY","HEWG","MXN","ETF","US","MEXI*"
"HEWG","ISHA HEDGED MSCI GERMANY","HEWG","USD","ETF","US","NASDAQ*"
"HEWJ","ISHA CURR HEDGED MSCI JAPAN","HEWJ","USD","ETF","US","ARCA*"
"HEWJ","ISHA CURR HEDGED MSCI JAPAN","HEWJ","MXN","ETF","US","MEXI*"
"HEZU","ISHARES CURRENCY HEDGED MSCI","HEZU","USD","ETF","US","ARCA*"
"HEZU","ISHARES CURRENCY HEDGED MSCI","HEZU","MXN","ETF","US","MEXI*"
"HF","DGA ABSOLUTE RETURN ETF","HF","USD","ETF","US","ARCA*"
"HFGO","HARTFORD LRG CAP GRWTH ETF","HFGO","USD","ETF","US","BATS*"
"HFND","UNLTD HFND MULT ST RET TRACK","HFND","USD","ETF","US","ARCA*"
"HFXI","IQ FTSE INTERNATIONAL EQUITY","HFXI","USD","ETF","US","ARCA*"
"HGER","HARBOR COMMODITY ALL WEATHER","HGER","USD","ETF","US","NYSE*"
"HGER","HARBOR COMMODITY ALL WEATHER","HGER","MXN","ETF","US","MEXI*"
"HIBL","DIREXION DAILY S&amp;P 500 HIGH","HIBL","USD","ETF","US","ARCA*"
"HIBS","DIREXION DAILY S&amp;P 500 HIGH","HIBS","USD","ETF","US","ARCA*"
"HIDE","ALPHA ARC HIGH INF &amp; DEF ETF","HIDE","USD","ETF","US","NASDAQ*"
"HIDV","AB US HIGH DIVIDEND ETF","HIDV","USD","ETF","US","ARCA*"
"HIGH","SIMPLIFY ENHANCED INCOME ETF","HIGH","USD","ETF","US","ARCA*"
"HIPS","GRANITESHARES HIPS US HIGH I","HIPS","USD","ETF","US","ARCA*"
"HISF","FIRST TR HI INC STRAT FOC","HISF","USD","ETF","US","NASDAQ*"
"HIYS","INVESCO HIGH YIELD SLCT ETF","HIYS","USD","ETF","US","BATS*"
"HJAN","INNOV PREM INC 9 BARR - JAN","HJAN","USD","ETF","US","BATS*"
"HJEN","DIREXION HYDROGEN ETF","HJEN","USD","ETF","US","ARCA*"
"HKND","HUMANKIND US STOCK ETF","HKND","USD","ETF","US","ARCA*"
"HLAL","WAHED FTSE USA SHARIAH ETF","HLAL","USD","ETF","US","NASDAQ*"
"HLGE","HARTFORD LONGEVITY ECONOMY","HLGE","USD","ETF","US","ARCA*"
"HMOP","HARTFORD MUNICIPAL OPP ETF","HMOP","USD","ETF","US","ARCA*"
"HNDL","NASDAQ 7 HANDL INDEX ETF","HNDL","USD","ETF","US","NASDAQ*"
"HOCT","INNOV PRM INC 9BUFF ETF OCT","HOCT","USD","ETF","US","BATS*"
"HODL","VANECK BITCOIN TRUST","HODL","USD","ETF","US","BATS*"
"HOMZ","HOYA CAPITAL HOUSING ETF","HOMZ","USD","ETF","US","ARCA*"
"HQGO","HARTFORD US QULTY GRWTH ETF","HQGO","USD","ETF","US","NASDAQ*"
"HRENW","HARBOR ENERGY TRANSITION ST","HRENW","MXN","ETF","US","MEXI*"
"HRTS","TEMA OBESITY &amp; CARDIOMETABOL","HRTS","USD","ETF","US","NASDAQ*"
"HSCZ","ISHARES CUR HDG MSCI EAFE SM","HSCZ","USD","ETF","US","ARCA*"
"HSMV","FIRST TRUST HORIZON MANAGED","HSMV","USD","ETF","US","ARCA*"
"HSRT","HARTFORD AAA CLO ETF","HSRT","USD","ETF","US","BATS*"
"HSUN","HARTFORD SUSTAINABLE INC ETF","HSUN","USD","ETF","US","BATS*"
"HTAB","HARTFORD SCHRODERS TAX AWARE","HTAB","USD","ETF","US","ARCA*"
"HTEC","ROBO GLOBAL HEALTHCARE TECH","HTEC","USD","ETF","US","ARCA*"
"HTRB","HARTFORD TTL RTRN BND ETF","HTRB","USD","ETF","US","ARCA*"
"HTUS","HULL TACTICAL US ETF","HTUS","USD","ETF","US","ARCA*"
"HUSV","FT HORIZON MNGD VOL DOM ETF","HUSV","USD","ETF","US","ARCA*"
"HYBB","ISHARES BB RATED CORP BOND","HYBB","USD","ETF","US","ARCA*"
"HYBL","SPDR BLACKSTONE HIGH INCOME","HYBL","USD","ETF","US","BATS*"
"HYD","VANECK HIGH YIELD MUNI ETF","HYD","USD","ETF","US","BATS*"
"HYDB","ISHARES HIGH YIELD SYSTEMATI","HYDB","USD","ETF","US","BATS*"
"HYDB","ISHARES HIGH YIELD SYSTEMATI","HYDB","MXN","ETF","US","MEXI*"
"HYDR","GLOBAL X HYDROGEN ETF","HYDR","USD","ETF","US","NASDAQ*"
"HYDR","GLOBAL X HYDROGEN ETF","HYDR","MXN","ETF","US","MEXI*"
"HYDW","XTRS LOW BETA HI YIELD ETF","HYDW","USD","ETF","US","ARCA*"
"HYEM","VANECK EMRG MKTS HI YLD","HYEM","MXN","ETF","US","MEXI*"
"HYEM","VANECK EMRG MKTS HI YLD","HYEM","USD","ETF","US","ARCA*"
"HYFI","AB HIGH YIELD ETF","HYFI","USD","ETF","US","ARCA*"
"HYG","ISHARES IBOXX HIGH YLD CORP","HYG","MXN","ETF","US","MEXI*"
"HYG","ISHARES IBOXX HIGH YLD CORP","HYG","USD","ETF","US","ARCA*"
"HYGH","ISHARES INT RATE HEDG HY ETF","HYGH","USD","ETF","US","ARCA*"
"HYGI","ISHARES INFLATION HEDGED HIG","HYGI","USD","ETF","US","ARCA*"
"HYGV","FLEXSHARES HIGH YIELD VALUE","HYGV","USD","ETF","US","ARCA*"
"HYGW","ISHARES HY CORP BD BUYWR ETF","HYGW","USD","ETF","US","BATS*"
"HYGW","ISHARES HY CORP BD BUYWR ETF","HYGW","MXN","ETF","US","MEXI*"
"HYHG","PROSHARES HIGH YIELD INTERES","HYHG","USD","ETF","US","BATS*"
"HYIN","WISDOMTREE ALTERNATIVE INCOM","HYIN","USD","ETF","US","BATS*"
"HYKE","VEST 2 YR INT RATE HDGE ETF","HYKE","USD","ETF","US","BATS*"
"HYLB","XTRACKERS USD HIGH YIELD COR","HYLB","USD","ETF","US","ARCA*"
"HYLB","XTRACKERS USD HIGH YIELD COR","HYLB","MXN","ETF","US","MEXI*"
"HYLG","GLOBAL X HLTH CARE COV CALL","HYLG","MXN","ETF","US","MEXI*"
"HYLG","GLOBAL X HLTH CARE COV CALL","HYLG","USD","ETF","US","ARCA*"
"HYLS","FT TACTICAL HIGH YIELD ETF","HYLS","USD","ETF","US","NASDAQ*"
"HYMB","SPDR NUVEEN BLOOMBERG HIGH Y","HYMB","USD","ETF","US","ARCA*"
"HYMU","BLACKROCK HIGH YIELD MUNI IN","HYMU","USD","ETF","US","BATS*"
"HYRM","XTRACKERS R/M USD HI YLD","HYRM","USD","ETF","US","ARCA*"
"HYS","PIMCO 0-5 YEAR H/Y CORP BOND","HYS","USD","ETF","US","ARCA*"
"HYSA","BONDBLOXX USD HY SEC ROTATON","HYSA","USD","ETF","US","ARCA*"
"HYTR","CP HIGH YIELD TREND ETF","HYTR","USD","ETF","US","ARCA*"
"HYUP","XTRS HI BETA HI YIELD ETF","HYUP","USD","ETF","US","ARCA*"
"HYUP","XTRS HI BETA HI YIELD ETF","HYUP","MXN","ETF","US","MEXI*"
"HYXF","ISHARES ESG ADV HIGH YIELD","HYXF","USD","ETF","US","NASDAQ*"
"HYXU","ISHARES INTERNATIONAL HIGH Y","HYXU","USD","ETF","US","BATS*"
"HYZD","WISDOMTREE INTEREST RATE HED","HYZD","MXN","ETF","US","MEXI*"
"HYZD","WISDOMTREE INTEREST RATE HED","HYZD","USD","ETF","US","NASDAQ*"
"IAGG","ISHARES INTL AGGREGATE BOND","IAGG","USD","ETF","US","BATS*"
"IAI","ISHARES U.S. BROKER-DEALERS","IAI","USD","ETF","US","ARCA*"
"IAK","ISHARES U.S. INSURANCE ETF","IAK","USD","ETF","US","ARCA*"
"IAPR","INNOVATOR INTERNATIONAL DEVE","IAPR","USD","ETF","US","ARCA*"
"IAT","ISHARES US REGIONAL BANKS ET","IAT","USD","ETF","US","ARCA*"
"IAU","ISHARES GOLD TRUST","IAU","USD","ETF","US","ARCA*"
"IAU","ISHARES GOLD TRUST","IAU","MXN","ETF","US","MEXI*"
"IAUF","ISHARES GOLD STRATEGY ETF","IAUF","MXN","ETF","US","MEXI*"
"IAUF","ISHARES GOLD STRATEGY ETF","IAUF","USD","ETF","US","BATS*"
"IAUM","ISHARES GOLD TRUST MICRO","IAUM","USD","ETF","US","ARCA*"
"IBAT","ISHARES ENERGY STRG MATS ETF","IBAT","USD","ETF","US","NASDAQ*"
"IBB","ISHARES BIOTECHNOLOGY ETF","IBB","MXN","ETF","US","MEXI*"
"IBB","ISHARES BIOTECHNOLOGY ETF","IBB","USD","ETF","US","NASDAQ*"
"IBBQ","INVESCO NASDAQ BIOTECH ETF","IBBQ","USD","ETF","US","NASDAQ*"
"IBD","INSPIRE CORPORATE BOND ETF","IBD","USD","ETF","US","ARCA*"
"IBDO","ISHARES IBONDS DEC 2023 TERM","IBDO","MXN","ETF","US","MEXI*"
"IBDP","ISHARES IBONDS DEC 2024 TERM","IBDP","USD","ETF","US","ARCA*"
"IBDP","ISHARES IBONDS DEC 2024 TERM","IBDP","MXN","ETF","US","MEXI*"
"IBDQ","ISHARES IBONDS DEC 2025 TERM","IBDQ","USD","ETF","US","ARCA*"
"IBDQ","ISHARES IBONDS DEC 2025 TERM","IBDQ","MXN","ETF","US","MEXI*"
"IBDR","ISHARES IBONDS DEC 2026 TERM","IBDR","USD","ETF","US","ARCA*"
"IBDR","ISHARES IBONDS DEC 2026 TERM","IBDR","MXN","ETF","US","MEXI*"
"IBDS","ISHRS IBNDS DEC 27 CORP ETF","IBDS","USD","ETF","US","ARCA*"
"IBDS","ISHRS IBNDS DEC 27 CORP ETF","IBDS","MXN","ETF","US","MEXI*"
"IBDT","ISHARES IBONDS DEC 2028 ETF","IBDT","USD","ETF","US","ARCA*"
"IBDU","ISHARES IBONDS DEC 2029 TERM","IBDU","USD","ETF","US","ARCA*"
"IBDV","ISHARES IBONDS DEC 2030 CORP","IBDV","USD","ETF","US","ARCA*"
"IBDW","ISHARES IBONDS DEC 2031 CORP","IBDW","USD","ETF","US","ARCA*"
"IBDX","ISHARES IBONDS DEC 2032 TC","IBDX","USD","ETF","US","ARCA*"
"IBDY","ISHARES IBONDS DEC 2033 CORP","IBDY","USD","ETF","US","ARCA*"
"IBDZ","ISHARESIBONDSDEC2034TMCORP","IBDZ","USD","ETF","US","ARCA*"
"IBHD","ISHARES IBONDS 2024 H/Y INC","IBHD","USD","ETF","US","BATS*"
"IBHD","ISHARES IBONDS 2024 H/Y INC","IBHD","MXN","ETF","US","MEXI*"
"IBHE","ISHARES IBONDS 2025 H/Y INC","IBHE","MXN","ETF","US","MEXI*"
"IBHE","ISHARES IBONDS 2025 H/Y INC","IBHE","USD","ETF","US","BATS*"
"IBHF","ISHARES IBOND 2026 HY &amp; INC","IBHF","MXN","ETF","US","MEXI*"
"IBHF","ISHARES IBOND 2026 HY &amp; INC","IBHF","USD","ETF","US","BATS*"
"IBHG","ISHARES IBONDS 2027 HY INC","IBHG","USD","ETF","US","BATS*"
"IBHH","ISHARES IBONDS 2028 TM HY IN","IBHH","USD","ETF","US","BATS*"
"IBHI","ISHARES IBONDS 2029 TM HY IN","IBHI","USD","ETF","US","BATS*"
"IBHJ","ISHRS IBDS 2030 HY &amp; INC ETF","IBHJ","USD","ETF","US","BATS*"
"IBHK","ISHARESIBOND2031HIGHYLDINC","IBHK","USD","ETF","US","BATS*"
"IBIA","ISHARES IBONDS OCT 2024 TT","IBIA","USD","ETF","US","ARCA*"
"IBIB","ISHARES IBONDS OCT 2025 TT","IBIB","USD","ETF","US","ARCA*"
"IBIC","ISHARES IBONDS OCT 2026 TT","IBIC","USD","ETF","US","ARCA*"
"IBID","ISHARES IBONDS OCT 2027 TT","IBID","USD","ETF","US","ARCA*"
"IBIE","ISHARES IBONDS OCT 2028 TT","IBIE","USD","ETF","US","ARCA*"
"IBIF","ISHARES IBONDS OCT 2029 TT","IBIF","USD","ETF","US","ARCA*"
"IBIG","ISHARES IBONDS OCT 2030 TT","IBIG","USD","ETF","US","ARCA*"
"IBIH","ISHARES IBONDS OCT 2031 TT","IBIH","USD","ETF","US","ARCA*"
"IBII","ISHARES IBONDS OCT 2032 TT","IBII","USD","ETF","US","ARCA*"
"IBIJ","ISHRS IBNDS OCT 2033 TRM","IBIJ","USD","ETF","US","ARCA*"
"IBIK","ISHARESIBONDSOCT2034TMTIPS","IBIK","USD","ETF","US","ARCA*"
"IBIT","ISHARES BITCOIN TRUST","IBIT","USD","ETF","US","NASDAQ*"
"IBLC","ISHARES BLOCKCHAIN &amp; TECH","IBLC","MXN","ETF","US","MEXI*"
"IBLC","ISHARES BLOCKCHAIN &amp; TECH","IBLC","USD","ETF","US","ARCA*"
"IBMM","ISHARES IBONDS DEC 2024 TERM","IBMM","USD","ETF","US","BATS*"
"IBMN","ISHARES IBONDS DEC 2025 TERM","IBMN","USD","ETF","US","BATS*"
"IBMO","ISHARES IBONDS DEC 2026 TERM","IBMO","USD","ETF","US","BATS*"
"IBMP","ISHARES IBONDS DEC 2027 TERM","IBMP","USD","ETF","US","BATS*"
"IBMQ","ISHARES IBONDS DEC 2028 MUNI","IBMQ","USD","ETF","US","BATS*"
"IBMR","ISHARES IBONDS DEC 2029 M BD","IBMR","USD","ETF","US","BATS*"
"IBMS","ISHARESIBONDDEC2030MUNIBDETF","IBMS","USD","ETF","US","BATS*"
"IBND","SPDR BLOOMBERG INT CORP","IBND","USD","ETF","US","ARCA*"
"IBOT","VANECK ROBOTICS ETF","IBOT","USD","ETF","US","NASDAQ*"
"IBRN","ISHARES NEUROSCIENCE AND HEA","IBRN","USD","ETF","US","ARCA*"
"IBTE","ISHARES IBONDS DEC 2024 TERM","IBTE","USD","ETF","US","NASDAQ*"
"IBTF","ISHARES IBONDS DEC 2025 TERM","IBTF","USD","ETF","US","NASDAQ*"
"IBTG","ISHARES IBONDS DEC 2026 TERM","IBTG","USD","ETF","US","NASDAQ*"
"IBTH","ISHARES IBONDS DEC 2027 TERM","IBTH","USD","ETF","US","NASDAQ*"
"IBTI","ISHARES IBONDS DEC 2028 TERM","IBTI","USD","ETF","US","NASDAQ*"
"IBTJ","ISHARES IBONDS DEC 2029 TERM","IBTJ","USD","ETF","US","NASDAQ*"
"IBTK","ISHARES IBONDS DEC 2030 TREA","IBTK","USD","ETF","US","NASDAQ*"
"IBTL","ISHARES IBONDS DEC 2031 TERM","IBTL","USD","ETF","US","NASDAQ*"
"IBTM","ISHARES IBNDS DEC 2032 TT","IBTM","USD","ETF","US","NASDAQ*"
"IBTO","ISHARES IBONDS DEC 2033 TRES","IBTO","USD","ETF","US","NASDAQ*"
"IBUY","AMPLIFY ONLINE RETAIL ETF","IBUY","USD","ETF","US","ARCA*"
"ICAP","INFRACAP EQTY INCOME FUND","ICAP","USD","ETF","US","ARCA*"
"ICF","ISHARES COHEN &amp; STEERS REIT","ICF","MXN","ETF","US","MEXI*"
"ICF","ISHARES COHEN &amp; STEERS REIT","ICF","USD","ETF","US","BATS*"
"ICLN","ISHARES GLOBAL CLEAN ENERGY","ICLN","MXN","ETF","US","MEXI*"
"ICLN","ISHARES GLOBAL CLEAN ENERGY","ICLN","USD","ETF","US","NASDAQ*"
"ICLO","INVESCO AAA CLO F/R NOTE ETF","ICLO","USD","ETF","US","BATS*"
"ICOP","ISHARES COPPER AND METALS","ICOP","USD","ETF","US","NASDAQ*"
"ICOW","PACER DEVELOPED MARKETS INTE","ICOW","USD","ETF","US","BATS*"
"ICSH","BLACKROCK ULTRA SHORT-TERM B","ICSH","USD","ETF","US","BATS*"
"ICVT","ISHARES CONVERTIBLE BOND ETF","ICVT","USD","ETF","US","BATS*"
"IDAT","ISHARES FUTURE CLOUD 5G AND","IDAT","MXN","ETF","US","MEXI*"
"IDAT","ISHARES FUTURE CLOUD 5G AND","IDAT","USD","ETF","US","ARCA*"
"IDEC","INNO INT DEV POWER BUFF DEC","IDEC","USD","ETF","US","ARCA*"
"IDEV","ISHARES CORE MSCI DEV MKTS","IDEV","MXN","ETF","US","MEXI*"
"IDEV","ISHARES CORE MSCI DEV MKTS","IDEV","USD","ETF","US","ARCA*"
"IDGT","ISHARES US DGTL INFRA &amp; R/E","IDGT","MXN","ETF","US","MEXI*"
"IDGT","ISHARES US DGTL INFRA &amp; R/E","IDGT","USD","ETF","US","ARCA*"
"IDHQ","INVESCO S&amp;P INTERNATIONAL DE","IDHQ","USD","ETF","US","ARCA*"
"IDLV","INVESCO S&amp;P INTERNATIONAL DE","IDLV","USD","ETF","US","ARCA*"
"IDMO","INVESCO S&amp;P INTERNATIONAL DE","IDMO","USD","ETF","US","ARCA*"
"IDNA","ISHARES GEN-IMMUNOLOGY HLTH","IDNA","USD","ETF","US","ARCA*"
"IDOG","ALPS INTERNATIONAL SECTOR DI","IDOG","USD","ETF","US","ARCA*"
"IDRV","ISHARES SELF-DRIVING EV&amp;TECH","IDRV","USD","ETF","US","ARCA*"
"IDU","ISHARES US UTILITIES ETF","IDU","USD","ETF","US","ARCA*"
"IDUB","APTUS INTERNATIONAL ENHANCED","IDUB","USD","ETF","US","BATS*"
"IDV","ISHARES INTERNATIONAL SELECT","IDV","USD","ETF","US","BATS*"
"IDVO","AMPLIFY CWP INTL EDI ETF","IDVO","USD","ETF","US","ARCA*"
"IDX","VANECK INDONESIA INDEX ETF","IDX","USD","ETF","US","ARCA*"
"IEDI","ISHARES U.S. CONSUMER FOCUSE","IEDI","USD","ETF","US","BATS*"
"IEF","ISHARES 7-10 YEAR TREASURY B","IEF","USD","ETF","US","NASDAQ*"
"IEF","ISHARES 7-10 YEAR TREASURY B","IEF","MXN","ETF","US","MEXI*"
"IEFA","ISHARES CORE MSCI EAFE ETF","IEFA","USD","ETF","US","BATS*"
"IEFA","ISHARES CORE MSCI EAFE ETF","IEFA","MXN","ETF","US","MEXI*"
"IEI","ISHARES 3-7 YEAR TREASURY BO","IEI","MXN","ETF","US","MEXI*"
"IEI","ISHARES 3-7 YEAR TREASURY BO","IEI","USD","ETF","US","NASDAQ*"
"IEMG","ISHARES CORE MSCI EMERGING","IEMG","MXN","ETF","US","MEXI*"
"IEMG","ISHARES CORE MSCI EMERGING","IEMG","USD","ETF","US","ARCA*"
"IEO","ISHARES U.S. OIL &amp; GAS EXPLO","IEO","USD","ETF","US","BATS*"
"IETC","ISHARES U.S. TECH INDEPENDEN","IETC","USD","ETF","US","BATS*"
"IEUR","ISHARES CORE MSCI EUROPE ETF","IEUR","USD","ETF","US","ARCA*"
"IEUS","ISHARES MSCI EUROPE SMALL-CA","IEUS","USD","ETF","US","NASDAQ*"
